2001;N2;どこかで客たちの笑う 声がする。;B;客;かく;きゃく;はく;ひゃく
2001;N2;どこかで客たちの笑う 声がする。;D;笑う;さそう;ならう;ねがう;わらう
2001;N2;どこかで客たちの笑う 声がする。;A;声;おと;おん;こえ;せい
2001;N2;鳥の豊かな秋が終わると、寒い冬が来る。;A;鳥;しま;ちょう;とう;とり
2001;N2;鳥の豊かな秋が終わると、寒い冬が来る。;D;豊かな;しずかな;たしかな;にわかな;ゆたかな
2001;N2;鳥の豊かな秋が終わると、寒い冬が来る。;C;寒い;おもい;くらい;さむい;ながい 
2001;N2;この物語は、国境を越えて 共感をよんでいる。;C;物語;ものかたり;ものかったり;ものがたり;ものかだり
2001;N2;この物語は、国境を越えて 共感をよんでいる。;B;越えて;かえて;こえて;そなえて;ふえて
2001;N2;この物語は、国境を越えて 共感をよんでいる。;A;共感;きょうかん;きょかん;こうかん;こかん
2001;N2;自分の考えがはっきり述べられる人を雇いたい。;D;述べられる;くらべられる;しらべられる;ならべられる;のべられる
2001;N2;自分の考えがはっきり述べられる人を雇いたい。;D;雇いたい;うかがいたい;うやまいたい;もちいたい;やといたい
2001;N2;星が雲にかくれた。;C;星;ふし;ふうし;ほし;ほうし
2001;N2;星が雲にかくれた。;A;雲;くも;しも;にじ;ゆき
2001;N2;氷は水に浮く。;B;氷;あぶら;こおり;こな;こめ
2001;N2;氷は水に浮く。;A;浮く;うく;ふく;まく;わく
2001;N2;交差点で車の通行を規則している。;C;交差点;こさてん;こざてん;こうさてん;こうざてん
2001;N2;交差点で車の通行を規則している。;D;通行;こつう;こうつう;つこう;つうこう
2001;N2;交差点で車の通行を規則している。;A;規則;きせい;きそく;きっせい;きっそく
2001;N2;もっと単純な処理ですませよう。;C;単純;かんたん;かんだん;たんじゅん;だんじゅん
2001;N2;もっと単純な処理ですませよう。;B;処理;しょち;しょり;そち;そり 
2001;N2;しゅうしょくが決まったら、かならずお知らせします。;B;しゅうしょく;就書;就職;辞書;辞職
2001;N2;しゅうしょくが決まったら、かならずお知らせします。;B;かならず;心ず;必ず;委ず;要ず
2001;N2;ここはパイロットのきょういくとくんれんにはさいこうのかんきょうだ。;C;きょういく;教生;教行;教育;教養
2001;N2;ここはパイロットのきょういくとくんれんにはさいこうのかんきょうだ。;A;くんれん;訓練;修練;習練;順練
2001;N2;ここはパイロットのきょういくとくんれんにはさいこうのかんきょうだ。;D;さいこう;最古;最好;最後;最高
2001;N2;ここはパイロットのきょういくとくんれんにはさいこうのかんきょうだ。;C;かんきょう;環状;環況;環境;環競
2001;N2;最近せなかやこしのほねが痛む。;B;せなか;肯中;背中;脊中;排中
2001;N2;最近せなかやこしのほねが痛む。;C;こし;腸;腹;腰;臓
2001;N2;最近せなかやこしのほねが痛む。;C;ほね;肩;胃;骨;腎
2001;N2;となりのむらのまつりで金魚を3びき買った。;C;むら;屯;邑;村;郡
2001;N2;となりのむらのまつりで金魚を3びき買った。;A;まつり;祭り;察り;蔡り;際り
2001;N2;となりのむらのまつりで金魚を3びき買った。;A;びき;匹;皿;羽;尾
2001;N2;この本を読んで、このじいんのこうぞうと、ほぞんの方法がよくわかった。;B;じいん;寺員;寺院;持員;持院
2001;N2;この本を読んで、このじいんのこうぞうと、ほぞんの方法がよくわかった。;B;こうぞう;構成;構造;講成;講造
2001;N2;この本を読んで、このじいんのこうぞうと、ほぞんの方法がよくわかった。;A;ほぞん;保存;保在;保左;保式 
2001;N2;じどうにスキーのしどうをするきょかをえた。;C;じどう;子童;子量;児童;児量
2001;N2;じどうにスキーのしどうをするきょかをえた。;B;しどう;指道;指導;師道;師導
2001;N2;じどうにスキーのしどうをするきょかをえた。;D;きょか;訂可;計可;記可;許可
2001;N2;千円未満のきんがくはししゃごにゅうしてもいいですか。;C;きんがく;金須;金頭;金額;金顔
2001;N2;千円未満のきんがくはししゃごにゅうしてもいいですか。;D;ししゃごにゅう;四者五人;四捨五人;四者五入;四捨五入
2001;N2;彼は目立つことがすきで、いつも________服を着ている。;B;Choisir une réponse pour _______________ ;じみな;はでな;あらたな;
2001;N2;風邪がとても________しているので、気をつけてください。;D;Choisir une réponse pour _______________ ;拡大;伝染;普及;流行
2001;N2;この国の________産業は農業で、とくに米作りがさかんです。;A;Choisir une réponse pour _______________ ;おもな;まれな;むだな;らくな
2001;N2;________が故障して、車が動かなくなった。;C;Choisir une réponse pour _______________ ;アクセント;アンテナ;エンジン;オイル
2001;N2;父は亡くなってから、母は________してぼくをそだててくれた。;D;Choisir une réponse pour _______________ ;苦情;苦学;苦痛;苦労
2001;N2;彼はこのレストランの評判を________にして、遠くからやってきた。;B;Choisir une réponse pour _______________ ;首;耳;口;手
2001;N2;あの薬局は夜遅くまで________しているので、便利だ。;A;Choisir une réponse pour _______________ ;営業;作業;授業;商業
2001;N2;彼女のように________人はだれからも好かれるだろう。;C;Choisir une réponse pour _______________ ;でたらめな;なだらかな;ほがらかな;わかままな
2001;N2;あの犬は彼にとって、 子どものようなものだ。;B;Choisir une réponse pour _______________ ;いずれ;いわば;さすが;まさか
2001;N2;薬が________、痛みが止まった。;A;Choisir une réponse pour _______________ ;きいて;きれて;なおって;はずれて 
2001;N2;口の中で食べ物のおいしさを楽しむこと。;A;Choisir une réponse ;あじわう;かんじる;しらべる;ふれる
2001;N2;見たり聞いたりして、思ったこと。;D;Choisir une réponse ;感覚;感謝;感心;感想
2001;N2;仕事などがたいへんで、くるしいようす。;C;Choisir une réponse ;あらい;くどい;つらい;ふかい
2001;N2;荷物を運ぶための自動車。;C;Choisir une réponse ;オートバイ;ドライブ;トラック;ロケット
2001;N2;言いにくいことや相手の知らない事情を説明するときに使う言葉。;C;Choisir une réponse ;現に;実に;実は;本来
2001;N2;微妙;B;Choisir une réponse ;微妙な品物を見つけたら、交番に届けてください;きのうと比べると、今日は川の水の色が微妙に違っている。;門の外に微妙な人が立っていたので、こわくなった。;中山さんのほうが私より微妙に年上だ。
2001;N2;あかり;C;Choisir une réponse ;それがあかりとなって犯人がつかまった。;ストーブのあかりでお湯をわかした。;暗いからあかりをつけてください。;夏の太陽のあかりはまぶしい。
2001;N2;むかい;D;Choisir une réponse ;海のむかいに船が見える。;この部屋は南むかいなので暖かい。;国へ帰ったとき、むかいで大山さんに会った。;山田さんの家はうちのむかいだ。
2001;N2;わずか;A;Choisir une réponse ;家から駅までわずか5分だ。;両親が死んで、私はわずかひとりになってしまった。;この問題はわずかに考えればできる。;先生の話はわずかすぎて聞こえなかった。
2001;N2;実施;D;Choisir une réponse ;長い間の夢が実施した。;理想と実施は違う。;理論的には可能だが、実施的には難しい。;新制度はいよいよ来年から実施される。
2001;N2;きのうはとてもたいくつな一日だった。;D;Choisir une réponse ;かなしい;たのしい;おもしろい;つまらない
2001;N2;このレストランは年中人でいっぱいだ。;A;Choisir une réponse ;いつも;たまに;しばしば;ときどき
2001;N2;明日は今日よりやや涼しいでしょう;B;Choisir une réponse ;もっと;すこし;たぶん;かえって
2001;N2;早く手術をしないと、命があぶない。;A;Choisir une réponse ;あやうい;けわしい;はげしい;みにくい
2001;N2;この曲はだれにでも歌いやすいテンポだ。;C;Choisir une réponse ;高さ;長さ;速さ;明るさ 
2001;N2;いったん仕事を引き付けた_______、途中で止めることはできない。;B;Choisir une réponse pour _______________ ;わけは;以上は;はずは;しだいは
2001;N2;参加国の首脳による話し合いは、5回に_______行われた。;C;Choisir une réponse pour _______________ ;そって;はいって;わたって;おうじて
2001;N2;私の見る_______、彼は信頼できる人物だ。;D;Choisir une réponse pour _______________ ;ほどでは;だけでは;とおりでは;かぎりでは
2001;N2;さっきの態度から_______、あの人はあやまる気は全然なさそうだ。;A;Choisir une réponse pour _______________ ;すると;いると;あると;くると
2001;N2;田中は出かけておりますので、_______ご連絡を差し上げます。;A;Choisir une réponse pour _______________ ;戻りしだい;戻るとおり;戻るままに;戻りながら
2001;N2;日本に来たばかりのときは、あいさつ_______日本語でできなかった。;B;Choisir une réponse pour _______________ ;でも;さえ;だけで;のみで
2001;N2;物を売る時は、値段が安ければいい_______、商品の質を第一に考えるべきだ。;C;Choisir une réponse pour _______________ ;というもので;としたもので;というものではなく;としたものではなく
2001;N2;主婦のアイディアを採り入れた新製品は、おもしろい_______よく売れた。;A;Choisir une réponse pour _______________ ;ほど;こそ;あまり;ばかり
2001;N2;当時に_______、海外旅行など夢のようなことだった。;C;Choisir une réponse pour _______________ ;よっては;そっては;おいては;あたっては
2001;N2;それぞれの説明をよく聞いた_______、旅行のコースを選びたいと思います。;B;Choisir une réponse pour _______________ ;うちに;うえで;ところに;おかげで
2001;N2;面接試験では、その人の能力_______服装までも判断の材料にされる。;D;Choisir une réponse pour _______________ ;としたら;のすえに;にしては;はもちろん
2001;N2;大学の移転_______さまざまな意見が出されている。;D;Choisir une réponse pour _______________ ;にとって;をこめて;にすれば;をめぐって
2001;N2;この劇場は、一番後ろの座席でもよく聞こえる_______設計されている。;A;Choisir une réponse pour _______________ ;ように;ために;だけに;ことに
2001;N2;この子は小学生_______ずいぶんしっかりしている。;B;Choisir une réponse pour _______________ ;にすると;にしては;にするなら;にしてから
2001;N2;先日の会議では彼の説明に_______質問が集中した。;D;Choisir une réponse pour _______________ ;つけて;おいて;とって;対して
2001;N2;物価は上がる_______生活は少し楽にならない。;C;Choisir une réponse pour _______________ ;とおりに;ついでに;ばかりに;しだいに
2001;N2;若い_______いろいろなことを経験させた方がいい。;D;Choisir une réponse pour _______________ ;くらいは;よりは;ほどは;うちは
2001;N2;この会社はタオルやせんざい_______さまざまな日用品をあつかっている。;B;Choisir une réponse pour _______________ ;とする;といった;とすると;といったら
2001;N2;彼は冷静な_______、本当はあわてものなんです。;A;Choisir une réponse pour _______________ ;ようで;ように;ようでは;ようなら
2001;N2;台風で電車が不通になっていたが、10時間_______運転を始めたそうだ。;C;Choisir une réponse pour _______________ ;ごろに;ほどに;ぶりに;ぐらいに 
2001;N2;料理の勉強を始めたといっても、まだ3ヵ月_______。;C;Choisir une réponse pour _______________ ;にわたる;に先立つ;にすぎない;にかぎらない
2001;N2;体をじょうぶにしたかったら、好ききらいをしないで何でも食べる_______。;C;Choisir une réponse pour _______________ ;そうだ;せいだ;ことだ;おかげだ
2001;N2;結婚して何十年もたつと、結婚記念日さえ忘れ_______。;A;Choisir une réponse pour _______________ ;がちになる;かけになる;きれなくなる;かけなくなる
2001;N2;最終電車に乗り遅れてしまったので、歩いて帰る_______。;D;Choisir une réponse pour _______________ ;うえはない;ほどはない;ものはない;ほかはない
2001;N2;雨が降っている夜には、できるだけ運転をしないほうがいい。事故を起こす_______。;A;Choisir une réponse pour _______________ ;おそれがある;ついでである;しだいだ;かぎりだ
2001;N2;田中さんが、病気の子供を一人で家においておく_______。;B;Choisir une réponse pour _______________ ;ことでもない;はずがない;ものにはしない;ほかではない
2001;N2;小さい子を一人で遠くに遊びに_______。;C;Choisir une réponse pour _______________ ;行ったものではない;行かないものではない;行かせるものではない;行かれるものではない
2001;N2;コーチの話では、彼が試合に出れば、優勝はまちがいない_______。;B;Choisir une réponse pour _______________ ;となることだ;ということだ;とならなくなる;とさせられている
2001;N2;なぜ彼女を好きになってしまったのかは、説明の_______。;D;Choisir une réponse pour _______________ ;わけがない;もとがない;しだいがない;しようがない 
2001;N2;この部屋には、関係者以外入ってはいけない_______。;B;Choisir une réponse pour _______________ ;ことではない;ことになっている;ことでもない;ことにあたっている 
2001;N2;この町でもどんどん人口が増加している。それに_______スーパーや銀行もでき、便利になってきた。;D;Choisir une réponse pour _______________ ;ついて;反して;対して;ともなって
2001;N2;彼は、けがをした足が痛むのもかまわず、_______。;C;Choisir une réponse pour _______________ ;大事な会議に欠席した;医者に足を見てもらった;工事現場を見てまわった;骨折していることがわかった
2001;N2;今年の夏は暑いのに、クーラーがさっぱり売れない。暑い夏ほどクーラーは_______と言われているが、違うんだろうか。;B;Choisir une réponse pour _______________ ;売れることだ;売れるものだ;売れるわけがない;売れようがない
2001;N2;若いころはお金がなくて、その日の食事にも困ることがあった。そんなとき下宿のおばさんは、私に食事をごちそうしてくれたばかりか、_______。;D;Choisir une réponse pour _______________ ;払えずにたまっていた部屋代を払わせた;食事代の変わりに下宿の掃除をしてあげた;下宿代をかせぐためのアルバイトをされた;しばらく暮らせるだけのお金まで貸してくれた
2001;N2;新しい店を開くために借金をした。借金_______、そんなに大した額ではないし、今後15年で返せばいいのだから大丈夫だ。;A;Choisir une réponse pour _______________ ;といっても;というより;といったら;といえば
2001;N2;野球大会の当日は、激しい雨が降っていた。それ_______大会は実施された。;C;Choisir une réponse pour _______________ ;に際して;にしたら;にもかかわらず;にもとづき 
